,review
241,고기 질이 눈으로 봐도 너무 좋은데 직접 구워주시기까지 해주셔서 맛있게 먹었습니다 !! 가족모임하기 정말 좋은 장소 같아요. 서비스가 좋아서 분위기 좋게 편하게 식사하고 나올 수 있었습니다 ! 편안한 가족모임 장소로 추천!!!
242,맛있게 잘 먹었습니다~!특히 냉면 맛집!!
243,직접잘구워즈시고 친절 하세요!
244,고기 질이 왕좋아용잡내안나서 좋고 매장이 쾌적해서 좋아욥 잘 묵다 갑니다 ~_~
245,맛있어요.가족 모임 좋네요.
246,고기가 너무 너무 맛있었고 직원분들이 친절하셨습니다.
247,"친구들과 급 벙개로 들어왔는데 문옆이긴 했지만 마지막 하나 남은 자리에 운좋게 앉았어요~ 고급스런 맛이였고, 굉장히 친절하셨어요!"
248,"네이버 예약으로는 3번째이고 그동안 총 방문은 4번째에요. 그동안 갔던 날 중에 음악소리가 제일 컸던 것 같아요. 맞은편 앉은 남편 목소리가 안 들릴 정도였거든요. 옆테이블도 술먹어서 목소리크지, 음악소리크지 좀 아쉬웠습니다. 늘 음식은 만족하고 잘 구워주셔서 편안하게 잘먹고옵니다! 그리고 리뉴얼된 반찬과 국이 너무 마음에 들었어요~ 숙주볶음 맛있고, 소고기뭇국도 따뜻하니 좋더라구요. 아이들있으니 후추 빼드리냐고 물어봐주셔서 감사했어요! "
249,"벽돌갈비, 홍벽갈비, 육회 다 맛있었어용"
250,
251,벽돌갈비 정말 제대로 취향저격이었습니다. 감칠맛이 엄청났어요. 숯불에 잘 구워주셔서 회식이나 모임장소로 방문하기 정말 좋겠더라고요. 상차림도 푸짐해서 만족도가 정말 높았던 곳이었습니다.
252,예약 후 방문했고 친구들과 맛있는 저녁 먹었습니다. 금요일 저녁엔 사람이 많아서 조금 시끌벅적 하긴 하지만 고기는 맛은 끝내줘요! 
253,너무 손님이 많아 정신없는 분위기지만 고기는 좋았어요
254,룸이 있는 고깃집. 외빈 모시기 좋아요.
255,인테리어는 멋져요.서비스 좋아요. 숙주볶음 맛있구요 근데  중요한 고기가  맛이 별로입니다. 양념갈비먹었는데 정말 별루이고 너무 두꺼워서 그런지 부드럽지않고 진짜 속상했습니다. 그리고 소고기를 넘 오래구워주시던데 그건 정말 아니라고 생각합니다. 
256,너무 맛있습니다~~~~.
257,시청에서 매번 롯데백화점가서 먹었는데 이제는 여기로 와야겟어요 재방문의사있습니다!
258,벽돌갈비부터 소양념갈비 존맛이에여!!! 
259,재방문했어요! 벽돌갈비 물냉 된찌 진짜 맛있어요👍🏻고기질 최고입니다. 강추
260,"고기도 직접 구워주시고, 고기도 너무너무 부드럽고 맛있어요!!! 부모님도 너무 좋아하시네요 ㅎㅎ"
261,회식으로 자주 오는데 점심 저녁 아주 좋습니다~ 점심은 직접 구워먹고 저녁은 구워주세요! 하이볼도 다양하고 넘넘 맛있습니다 ㅎㅎ
262,덥고 꿉꿉한 날씨에 딱이네요!!회사동료들과 가서 맛있게 먹었어요!공간도 넓고 청결해서 담에 친구들과 고기먹으러 가야겠어요!
263,월가갈비 양도 많고 벌써 3번째 방문입니다!!돼지갈비 먹었는데 돼지갈비도 부드럽고 양 많습니다! 정갈하니 깔끔 반찬에 분위기 큰 매장까지 대접하기 좋은 곳입니다!! 개인적으로는 근데 벽돌갈비가 👍👍👍 더 맛있어요 !!!  다음엔 벽돌갈비 먹을게요😊
264,홍벽갈비 너무 맛있어요 정말 잘먹었습니다
265,룸 예약했으나 룸이 없어 홀 예약으로 변경 제일 조용한 자리 주신다더니 중간에 덩그러니. 그럴 거면 유선상으로 약속을 하지 말던가. 그냥 예약 거절하기 싫어서 우선 말만 그렇게 한듯
266,매장이 깨끗하고 멋집니다. 고기도 맛있고 직윈분들이 친절합니다 ㅎ 또 오겠습니다
267,일부러  찾게되는곳  저번보다 고기가 살짝 질겻지만갠춘
268,맛좋고 친절 굿
269,직원들이 너무 친절하고 고기를 잘 구워주세요!!
270,고기가 연하고 정말 맛있네요~
271,"깨끗하고 고기 마은 좋네요. 다만 모든고기를 구워주는게 아니고, 메뉴에 따라 구워주기도 아니기도 해서 좀 불편하네요."
272,"네이버 예약시 오미자하이볼을 주셔서 고기와 함께 먹었는데 레몬도 넣어주셨고 분위기&맛 너무 좋았어요~ 명이나물, 신김치, 백김치, 연근, 단호박감자샐러드, 잡채, 소고기무국, 파무침이 기본 세팅되고 처음 주문한 고기는 구워주십니다. 된짱찌개 추가주문했는데 정말 정말 맛있어요. 돼지갈비 3인분 먹고 추가로 제주돼지 목살 1인분 주문했고요 주말 공휴일엔 3인분 주문시 1인분이 추가로 제공되서 돼지갈비는 4인분 먹었어요. 2명 가려다 4명이 식사했는데 고기구워주신 예쁜 이모님께도 감사드려요. 아이 입맛이 까다로운데 친절하게 응대해주셔서 정말 감사드립니다. 이미 식사중에 사진을 부랴부랴 찍어서 다 담을 순 없었지만, 연중무휴고 가까운 호텔에 숙박했고 도보 5분거리였고 역에서도 접근성이 좋아요."
273,고기 진짜 맛있어요. 알바분들도 친절합니다!
274,고기도 직접 구워주시고 음식 맛도 너무 좋고 친절하셔서 다음에 꼭 또 올 거 같아요!
275,같은 고기라도 왕커서 왕맛있어요!
276,고기 진짜 부드럽고 맛있습니다!
277,고기 진짜 부드러워요 너무 맛있습니다제발 와서 드셔주세요🤟
278,근처 호텔 호캉스 하면서저녁식사 장소로 우연히 왔는데갈비 완전 맛있고 직원분이 다 구워주셔서 좋았어요.
279,맛은 괜찮은데 고기 양이 생각보다 적더라고요
280,아이들과 왔는데 맛있네요.
281,고기가 사르르 녹아요 ㅠㅠ 넘 맛있어요 주말에 3+1 행사해서 덜 부담스럽고 좋았어요 다들 친절하시구 세번째 방문이지만 다음에도 또 올게요🙂
282,친절하고 음식도 맛있어요!!
283,너무 좋아요 추천합니당 최고에요!!
284,반찬부터 고기까지 맛있네요~ 가까우면 좋았겠네요 ㅎㅎ친구와함께 추천이요
285,오랜만에 가족모임 좋은 식사 했습니다. 반찬 구성도 푸짐하고 반찬 하나 하나 다 맛있습니다. 간만에 좋은 식당 발견 했네요. 진짜 맛있습니다. 재방문 의사 있습니다
286,고기 퀄리티가 너무 좋네요
287,너무 맛있어요
288,"오늘 가족여행으로 서울 나들이 왔는데, 맛집을 알아서 너무 기분이 좋네요👍👍직원분들 진짜 친절하고 고기 맛도 진짜 맛있습니다!!!너무 맛있게 잘 먹었습니다!!!또 오고싶네요!!👍👍👍"
289,편하게 구워주셔서 좋았고 고기고 질 좋고 맛있어요 사이드 된찌도 존맛탱 앞으로 자주 올듯!!
290,월가갈비 시청점 덕분에 연말 송년회 풍성하고 기름지게 하고왔어요. 갈비는 먹자마자 사르르 녹는듯한 육즙이 정말 대박이고요 못참고 양념갈비에 돼지고기 모둠까지 먹어버렸네요 고기도 직접 구워주셔서 최상의 컨디션으로 드실수 있고요 또 볶음밥까지 드셔주시는건 필수에요!!
291,음식이 정갈해서 좋아요~
292,잘먹고갑니다. 회식.모임에 좋음.
293,굿귯 아주 마싯어뇨 ! 예약없이도 바로 입장 했어요 ~
294,직접 고기를 구워주는것은 좋아요.분위기 별로고반찬도 별로고다 광고발이었어요.
295,직원분이 친절하고 고기가 맛있어요!!
296,
297,이번달에도 방문 완료! 제 최애 고깃집!! 각종 이벤트참여 많이해서 서비스 왕창 받았어요ㅎㅎ 다음달에도 방문 예정입니다!
298,"룸도 잘 되어있고 고기도 맛있어요, 그런데 직원들 응대는 조금 미흡한 느낌이에요."
299,날씨 좋아 나들이  나왔다가   맛집검색해서 왔어요.   행사도 해서 3 +1로 양념갈비  맛있게 먹고있어요 . 
